[
  {
    "id": "probability-basic-001",
    "type": "MC",
    "primarySkill": "probability-basic",
    "secondarySkills": [],
    "difficulty": 1,
    "stem": "A fair six-sided die is rolled once. What is the probability of rolling an even number?",
    "options": [
      {
        "id": "A",
        "text": "\\(1/6\\)"
      },
      {
        "id": "B",
        "text": "\\(1/3\\)"
      },
      {
        "id": "C",
        "text": "\\(1/2\\)"
      },
      {
        "id": "D",
        "text": "\\(2/3\\)"
      },
      {
        "id": "E",
        "text": "\\(5/6\\)"
      }
    ],
    "answer": "C",
    "solutionStandard": "Even outcomes are 2, 4, 6: \\(3\\) out of \\(6\\), so \\(P = 3/6 = 1/2\\).",
    "timeTargetSec": 35
  },
  {
    "id": "probability-basic-002",
    "type": "MC",
    "primarySkill": "probability-basic",
    "secondarySkills": [],
    "difficulty": 1,
    "stem": "Two fair coins are flipped. What is the probability that both show heads?",
    "options": [
      {
        "id": "A",
        "text": "\\(1/8\\)"
      },
      {
        "id": "B",
        "text": "\\(1/4\\)"
      },
      {
        "id": "C",
        "text": "\\(1/3\\)"
      },
      {
        "id": "D",
        "text": "\\(1/2\\)"
      },
      {
        "id": "E",
        "text": "\\(3/4\\)"
      }
    ],
    "answer": "B",
    "solutionStandard": "The coins are independent: \\(P(\\text{both heads}) = \\frac{1}{2} \\times \\frac{1}{2} = \\frac{1}{4}\\).",
    "timeTargetSec": 40
  },
  {
    "id": "probability-basic-003",
    "type": "Numeric",
    "primarySkill": "probability-basic",
    "secondarySkills": [],
    "difficulty": 2,
    "stem": "A bag contains 5 red, 3 blue, and 2 green marbles. What is the probability of drawing a red marble, expressed as a percent? (Enter your answer as a number, without the percent sign.)",
    "answer": 50,
    "solutionStandard": "Total marbles \\(= 10\\). \\(P(\\text{red}) = 5/10 = 0.5 = 50\\%\\).",
    "timeTargetSec": 50
  },
  {
    "id": "probability-basic-004",
    "type": "MC",
    "primarySkill": "probability-basic",
    "secondarySkills": [],
    "difficulty": 2,
    "stem": "A card is drawn at random from a standard 52-card deck (12 face cards: jack, queen, king in each of 4 suits). What is the probability the card is a face card?",
    "options": [
      {
        "id": "A",
        "text": "\\(1/13\\)"
      },
      {
        "id": "B",
        "text": "\\(3/13\\)"
      },
      {
        "id": "C",
        "text": "\\(1/4\\)"
      },
      {
        "id": "D",
        "text": "\\(4/13\\)"
      },
      {
        "id": "E",
        "text": "\\(1/3\\)"
      }
    ],
    "answer": "B",
    "solutionStandard": "\\(P(\\text{face card}) = 12/52 = 3/13\\).",
    "timeTargetSec": 50
  },
  {
    "id": "probability-basic-005",
    "type": "QC",
    "primarySkill": "probability-basic",
    "secondarySkills": [],
    "difficulty": 2,
    "stem": "Two fair six-sided dice are rolled.",
    "quantityA": "The probability that the sum is 7",
    "quantityB": "The probability that the sum is 2",
    "answer": "A",
    "solutionStandard": "Sum of 7 has 6 favorable outcomes out of 36 (\\(P=6/36\\)); sum of 2 has only 1 outcome (1,1), so \\(P=1/36\\). Since \\(6/36 > 1/36\\), Quantity A is greater.",
    "timeTargetSec": 60
  },
  {
    "id": "probability-basic-006",
    "type": "MultiMC",
    "primarySkill": "probability-basic",
    "secondarySkills": [],
    "difficulty": 3,
    "stem": "A bag has 4 red and 6 blue marbles, and one marble is drawn at random. Which of the following are true? Select all that apply.",
    "options": [
      {
        "id": "A",
        "text": "\\(P(\\text{red}) = 2/5\\)"
      },
      {
        "id": "B",
        "text": "\\(P(\\text{blue}) = 3/5\\)"
      },
      {
        "id": "C",
        "text": "\\(P(\\text{red}) + P(\\text{blue}) = 1\\)"
      },
      {
        "id": "D",
        "text": "\\(P(\\text{red}) = P(\\text{blue})\\)"
      }
    ],
    "answer": [
      "A",
      "B",
      "C"
    ],
    "solutionStandard": "\\(P(\\text{red}) = 4/10 = 2/5\\) and \\(P(\\text{blue}) = 6/10 = 3/5\\). These are complementary events, so they must sum to 1. They are not equal to each other.",
    "timeTargetSec": 75
  },
  {
    "id": "probability-basic-007",
    "type": "MC",
    "primarySkill": "probability-basic",
    "secondarySkills": [],
    "difficulty": 3,
    "stem": "Events \\(A\\) and \\(B\\) are independent, with \\(P(A) = 0.4\\) and \\(P(B) = 0.5\\). What is \\(P(A \\text{ and } B)\\)?",
    "options": [
      {
        "id": "A",
        "text": "0.1"
      },
      {
        "id": "B",
        "text": "0.2"
      },
      {
        "id": "C",
        "text": "0.4"
      },
      {
        "id": "D",
        "text": "0.5"
      },
      {
        "id": "E",
        "text": "0.9"
      }
    ],
    "answer": "B",
    "solutionStandard": "\\(P(A \\text{ and } B) = P(A) \\times P(B) = 0.4 \\times 0.5 = 0.2\\).",
    "timeTargetSec": 45
  },
  {
    "id": "probability-basic-008",
    "type": "Numeric",
    "primarySkill": "probability-basic",
    "secondarySkills": [],
    "difficulty": 3,
    "stem": "A jar has balls numbered 1 through 8. One ball is drawn at random. What is the probability, as a percent, that the number is greater than 5? (Enter your answer as a number, without the percent sign.)",
    "answer": 37.5,
    "solutionStandard": "Favorable outcomes are 6, 7, 8: \\(3\\) out of \\(8\\). \\(P = 3/8 = 0.375 = 37.5\\%\\).",
    "timeTargetSec": 55
  },
  {
    "id": "probability-basic-009",
    "type": "MC",
    "primarySkill": "probability-basic",
    "secondarySkills": [
      "counting-combinations"
    ],
    "difficulty": 4,
    "stem": "A committee of 2 people is chosen at random from a group of 4 men and 3 women. What is the probability that both people chosen are women?",
    "options": [
      {
        "id": "A",
        "text": "\\(1/7\\)"
      },
      {
        "id": "B",
        "text": "\\(1/6\\)"
      },
      {
        "id": "C",
        "text": "\\(3/7\\)"
      },
      {
        "id": "D",
        "text": "\\(3/21\\)"
      },
      {
        "id": "E",
        "text": "\\(1/3\\)"
      }
    ],
    "answer": "A",
    "solutionStandard": "Total ways to choose 2 from 7: \\(\\binom{7}{2}=21\\). Ways to choose 2 women from 3: \\(\\binom{3}{2}=3\\). \\(P = 3/21 = 1/7\\).",
    "timeTargetSec": 90
  },
  {
    "id": "probability-basic-010",
    "type": "MC",
    "primarySkill": "probability-basic",
    "secondarySkills": [],
    "difficulty": 4,
    "stem": "A fair coin is flipped 3 times. What is the probability of getting at least one head?",
    "options": [
      {
        "id": "A",
        "text": "\\(1/8\\)"
      },
      {
        "id": "B",
        "text": "\\(3/8\\)"
      },
      {
        "id": "C",
        "text": "\\(1/2\\)"
      },
      {
        "id": "D",
        "text": "\\(5/8\\)"
      },
      {
        "id": "E",
        "text": "\\(7/8\\)"
      }
    ],
    "answer": "E",
    "solutionStandard": "\\(P(\\text{no heads}) = P(\\text{all tails}) = (1/2)^3 = 1/8\\). \\(P(\\text{at least one head}) = 1 - 1/8 = 7/8\\).",
    "solutionShortcut": "\"At least one\" is the complement of \"none.\" Compute the easy case (all tails) and subtract from 1, instead of adding up the cases with exactly 1, 2, or 3 heads.",
    "shortcutTags": [
      "estimate"
    ],
    "timeTargetSec": 65
  }
]
