[
  {
    "id": "linear-equations-one-var-001",
    "type": "MC",
    "primarySkill": "linear-equations-one-var",
    "secondarySkills": [],
    "difficulty": 1,
    "stem": "If $3x + 5 = 20$, what is the value of $x$?",
    "options": [
      { "id": "A", "text": "3" },
      { "id": "B", "text": "5" },
      { "id": "C", "text": "7" },
      { "id": "D", "text": "8" },
      { "id": "E", "text": "15" }
    ],
    "answer": "B",
    "solutionStandard": "$3x = 20 - 5 = 15$, so $x = 5$.",
    "timeTargetSec": 40
  },
  {
    "id": "linear-equations-one-var-002",
    "type": "Numeric",
    "primarySkill": "linear-equations-one-var",
    "secondarySkills": [],
    "difficulty": 1,
    "stem": "If $2(x - 4) = 10$, what is the value of $x$?",
    "answer": 9,
    "solutionStandard": "$2x - 8 = 10$, so $2x = 18$, and $x = 9$.",
    "timeTargetSec": 45
  },
  {
    "id": "linear-equations-one-var-003",
    "type": "QC",
    "primarySkill": "linear-equations-one-var",
    "secondarySkills": [],
    "difficulty": 2,
    "stem": "$5x - 3 = 2x + 9$",
    "quantityA": "$x$",
    "quantityB": "$3$",
    "answer": "A",
    "solutionStandard": "$5x - 2x = 9 + 3$, so $3x = 12$, and $x = 4$. Since $4 > 3$, Quantity A is greater.",
    "timeTargetSec": 55
  },
  {
    "id": "linear-equations-one-var-004",
    "type": "MC",
    "primarySkill": "linear-equations-one-var",
    "secondarySkills": [],
    "difficulty": 2,
    "stem": "The sum of a number and 7 is 3 less than twice the number. What is the number?",
    "options": [
      { "id": "A", "text": "8" },
      { "id": "B", "text": "9" },
      { "id": "C", "text": "10" },
      { "id": "D", "text": "11" },
      { "id": "E", "text": "12" }
    ],
    "answer": "C",
    "solutionStandard": "Let $n$ be the number. $n + 7 = 2n - 3$, so $10 = n$.",
    "solutionShortcut": "Backsolve from the choices: test $n=10$: sum with 7 is 17; twice the number minus 3 is $20-3=17$. Matches.",
    "shortcutTags": ["backsolve"],
    "timeTargetSec": 70
  },
  {
    "id": "linear-equations-one-var-005",
    "type": "Numeric",
    "primarySkill": "linear-equations-one-var",
    "secondarySkills": [],
    "difficulty": 2,
    "stem": "If $\\frac{x}{4} + 3 = 8$, what is the value of $x$?",
    "answer": 20,
    "solutionStandard": "$\\frac{x}{4} = 5$, so $x = 20$.",
    "timeTargetSec": 45
  },
  {
    "id": "linear-equations-one-var-006",
    "type": "MC",
    "primarySkill": "linear-equations-one-var",
    "secondarySkills": [],
    "difficulty": 3,
    "stem": "If $\\frac{2x+1}{3} = \\frac{x-2}{2}$, what is the value of $x$?",
    "options": [
      { "id": "A", "text": "-8" },
      { "id": "B", "text": "-4" },
      { "id": "C", "text": "4" },
      { "id": "D", "text": "8" },
      { "id": "E", "text": "10" }
    ],
    "answer": "A",
    "solutionStandard": "Cross-multiply: $2(2x+1) = 3(x-2)$, so $4x + 2 = 3x - 6$, giving $x = -8$.",
    "timeTargetSec": 80
  },
  {
    "id": "linear-equations-one-var-007",
    "type": "MultiMC",
    "primarySkill": "linear-equations-one-var",
    "secondarySkills": [],
    "difficulty": 3,
    "stem": "$4x - 6 = 2x + 8$. Which of the following are equal to $x$? Select all that apply.",
    "options": [
      { "id": "A", "text": "7" },
      { "id": "B", "text": "$\\sqrt{49}$" },
      { "id": "C", "text": "$14/2$" },
      { "id": "D", "text": "$21/3$" }
    ],
    "answer": ["A", "B", "C", "D"],
    "solutionStandard": "$2x = 14$, so $x = 7$. All four options equal 7: $\\sqrt{49}=7$, $14/2=7$, $21/3=7$.",
    "timeTargetSec": 70
  },
  {
    "id": "linear-equations-one-var-008",
    "type": "MC",
    "primarySkill": "linear-equations-one-var",
    "secondarySkills": ["percent-basics"],
    "difficulty": 3,
    "stem": "A number increased by 30% of itself equals 65. What is the number?",
    "options": [
      { "id": "A", "text": "45" },
      { "id": "B", "text": "48" },
      { "id": "C", "text": "50" },
      { "id": "D", "text": "52" },
      { "id": "E", "text": "55" }
    ],
    "answer": "C",
    "solutionStandard": "$x + 0.30x = 65$, so $1.30x = 65$, and $x = 50$.",
    "solutionShortcut": "Backsolve: test $x=50$: $50 + 15 = 65$. Matches.",
    "shortcutTags": ["backsolve"],
    "timeTargetSec": 75
  },
  {
    "id": "linear-equations-one-var-009",
    "type": "QC",
    "primarySkill": "linear-equations-one-var",
    "secondarySkills": [],
    "difficulty": 4,
    "stem": "$3(x - 2) - x = 2x - 6$",
    "quantityA": "$x$",
    "quantityB": "$0$",
    "answer": "D",
    "solutionStandard": "$3x - 6 - x = 2x - 6$ simplifies to $2x - 6 = 2x - 6$, which is true for every value of $x$. Since $x$ could be any real number, the relationship to 0 cannot be determined.",
    "timeTargetSec": 85
  },
  {
    "id": "linear-equations-one-var-010",
    "type": "MC",
    "primarySkill": "linear-equations-one-var",
    "secondarySkills": [],
    "difficulty": 4,
    "stem": "If $\\frac{1}{x} + \\frac{1}{2x} = \\frac{3}{4}$, what is the value of $x$?",
    "options": [
      { "id": "A", "text": "$1$" },
      { "id": "B", "text": "$\\frac{4}{3}$" },
      { "id": "C", "text": "$2$" },
      { "id": "D", "text": "$3$" },
      { "id": "E", "text": "$4$" }
    ],
    "answer": "C",
    "solutionStandard": "$\\frac{1}{x} + \\frac{1}{2x} = \\frac{2}{2x} + \\frac{1}{2x} = \\frac{3}{2x}$. Setting $\\frac{3}{2x} = \\frac{3}{4}$ gives $2x = 4$, so $x = 2$.",
    "timeTargetSec": 90
  }
]
